{"authority_sha256":"744415942cec7636d450b927db291a085ab99c26beafeccd5167dcda6a302c7e","base_manifest_sha256":"7b4ab5d2146939d142eb92d43060ef2183c95d1fc574132894b3c01c874c7c56","companion_sha256":"a81ad7f3e5cc7e386a9313f6d5355afc1ec95757a5c9a4051ea94b79eafeceb0","complete":false,"conformance_sha256":"d8439031d76caaeb2dd8a2af8ba2d2eed7843fb1634f90f74e5f5c6d85d8d32e","distribution_id":"draft_2026_08_signed_neutral_10","distribution_schema":"nostr_automerge.fixture_distribution.v10","files":[{"path":"fixtures/schema/distribution.schema.v10.json","sha256":"4c61490648e97f53ed074561794a7dfa5c39d60817846cfa6d6489cd8570b818"},{"path":"fixtures/schema/distribution.schema.v9.json","sha256":"d66a16743ea59ce41dd1d6ccc440bf60e5759f54adce5944af56beb8a3752d7b"},{"path":"fixtures/schema/fixture.schema.json","sha256":"fd5ff2cb4622820338c965fbebafac7d0f047253108f37ca5a67bc370825dcb7"},{"path":"fixtures/schema/fixture.schema.v5.json","sha256":"eac26cb04a538db5c7c6cdf8041a4e7a42ac06d667adf987a611341e732d9254"},{"path":"fixtures/schema/fixture.schema.v6.json","sha256":"e7559bce6cf3de8856f0be87cf6a44027298d6a9f3f40d8bfb487298c7e40c03"},{"path":"fixtures/schema/fixture.schema.v7.json","sha256":"e0b8004e28c796d812a60e7ab4ff092d83a3a13af7f97dc90755cd7ab127d3ba"},{"path":"fixtures/schema/fixture.schema.v8.json","sha256":"a0d78b574dbf89ef3f7b5cb44c3d4cd11de638f878908f3a0e191d79d0adb7b1"},{"path":"fixtures/schema/interop_attestation.schema.json","sha256":"99d4785d8105cd6fb3e2f8221a784e153f64b00eedd9025cb4f8bb03623145a9"},{"path":"fixtures/schema/interop_attestation_v2.schema.json","sha256":"a7bd93cbd88e4f01a152984a8f4fd923c28461e35cef54a7330898c54226ad5d"},{"path":"fixtures/schema/interop_attestation_v3.schema.json","sha256":"e99d394d70d7ca346cd28fe4c24166e5799568904fdca7edc742af8a7ff275fb"},{"path":"fixtures/schema/report.schema.json","sha256":"08a88d5ad7049203bb766dc763601a6c5311a70e631fa35ab62c164203cd8e1c"},{"path":"fixtures/schema/report.schema.v2.json","sha256":"ba9b6abba54723f91fbf6cb45339f167dd09a935a67eeee425ecfac22d59d0bf"},{"path":"fixtures/schema/report.schema.v3.json","sha256":"7a400228bf510aa1ebcac7b7a92df460ba6fa8ab50c6fbfbf40c875fa90d5cf9"},{"path":"fixtures/schema/report.schema.v4.json","sha256":"9216cd3dcbb7449622e383daceae59cf7f122a1646f7505ad4aa6204569c9f63"},{"path":"fixtures/schema/scenario.schema.json","sha256":"57dce7d354b8e8027371b0dd70bce4350844774338c46f5b25f19ee57dbe7a91"},{"path":"fixtures/schema/scenario_v2.schema.json","sha256":"e287e8af4dacb0801b9713cf6bd5b85b5a16c97fe5a3a7d59a9a97b1dffb759f"},{"path":"fixtures/schema/scenario_v3.schema.json","sha256":"aec8633fcbfcf5a43c0d3561f3ab20469fc5c87cca659445fedc99c933d86e8e"},{"path":"fixtures/v1_draft/scenarios/actor_counters/actor_counter_empty_frontier.expected.json","sha256":"8cd534c2a2c6f83ecd19486f00e8330d271d2d15e2aea8378d6fa26261566db4"},{"path":"fixtures/v1_draft/scenarios/actor_counters/actor_counter_empty_frontier.fixture.json","sha256":"ee924ade4b4276ed7c1a92c413885ec9aa084cf29d38f1f61b199f6352593aa2"},{"path":"fixtures/v1_draft/scenarios/actor_counters/actor_counter_empty_frontier.input.json","sha256":"f6dba9eaeae15bd117e577f207b4c443403ba0264d9b223504d743f29c91faf3"},{"path":"fixtures/v1_draft/scenarios/actor_counters/actor_counter_empty_preservation.expected.json","sha256":"76d1beac8ed1f11119edd48dafd013a4fed83b766af9648c5134aa6ea734a037"},{"path":"fixtures/v1_draft/scenarios/actor_counters/actor_counter_empty_preservation.fixture.json","sha256":"6352b4c368db5181dfe7108ee341237e5f9bb255d0f2de93822922e90d6745e0"},{"path":"fixtures/v1_draft/scenarios/actor_counters/actor_counter_empty_preservation.input.json","sha256":"878f3c53da0301dba824420b65e17a0e2fe76a983b700010d6404911996042d6"},{"path":"fixtures/v1_draft/scenarios/actor_counters/actor_counter_exact_predecessor.expected.json","sha256":"263ccfaee1edf3b3bf93673378b8ad3687f7fc615e8a7c0c3e70fc2f7e5b60c4"},{"path":"fixtures/v1_draft/scenarios/actor_counters/actor_counter_exact_predecessor.fixture.json","sha256":"7dfab1e44a96ed3cb788c0c99963998f56a0477ed5eb304e6de29febba1888d8"},{"path":"fixtures/v1_draft/scenarios/actor_counters/actor_counter_exact_predecessor.input.json","sha256":"21b2f46d27ba8cd37bdd8451b720c129cc71db70d884ebf6cc5223db84dfcf96"},{"path":"fixtures/v1_draft/scenarios/actor_counters/actor_counter_missing_predecessor.expected.json","sha256":"f6fe701d57ca3f7c7a411b09c390fcaafb3f9663b476509569def361a41cf703"},{"path":"fixtures/v1_draft/scenarios/actor_counters/actor_counter_missing_predecessor.fixture.json","sha256":"7133137ac2062aebc9ec9f981ca167e79bff59f36af22a07c050d692e2bd8088"},{"path":"fixtures/v1_draft/scenarios/actor_counters/actor_counter_missing_predecessor.input.json","sha256":"c887ce3da0afc7a19bc1083dae8c9e9f4d33038b98233474bdd09b6c2d29cfd7"},{"path":"fixtures/v1_draft/scenarios/actor_counters/actor_counter_sequence_gap.expected.json","sha256":"a2eb68cbf7e18eef617c1e967a3f0e0e89efafdf3e8abd0dfbd58f2b6dba693d"},{"path":"fixtures/v1_draft/scenarios/actor_counters/actor_counter_sequence_gap.fixture.json","sha256":"259aca71ecd57e6d5608200b3574b884f48901c7c8bd9021976003f25db38d79"},{"path":"fixtures/v1_draft/scenarios/actor_counters/actor_counter_sequence_gap.input.json","sha256":"e0cf59c5a0e8f1d34c327f600b78931a10c767a5b53525d1128cecce44fec95e"},{"path":"fixtures/v1_draft/scenarios/actor_counters/actor_counter_sequence_rollback.expected.json","sha256":"8db8168c2ac705e0b7d3501752aa584a21c507ec233a79932d4451a8e36f735d"},{"path":"fixtures/v1_draft/scenarios/actor_counters/actor_counter_sequence_rollback.fixture.json","sha256":"73e879e3e95daa6e1e899239e8acce42db093a7a0f42f8c89c6b5188110e0dfd"},{"path":"fixtures/v1_draft/scenarios/actor_counters/actor_counter_sequence_rollback.input.json","sha256":"973fa2080fe703cf62a9ea6e4e97b66de0192e6f2d0aa5b27ce70a436a5b51da"},{"path":"fixtures/v1_draft/scenarios/actor_counters/actor_counter_sequence_start.expected.json","sha256":"18bc574150c0cc98fd9111ed3d8859a1a7b00a68972949bc04cedf6b6a2d89d5"},{"path":"fixtures/v1_draft/scenarios/actor_counters/actor_counter_sequence_start.fixture.json","sha256":"1b345a629c7ca26b6e4896506964a9b2694d856d18e38c9a3d6985b3bab9cc6b"},{"path":"fixtures/v1_draft/scenarios/actor_counters/actor_counter_sequence_start.input.json","sha256":"5d097263120cbd5f48f1f4fa053a28595146f1ce14b66c11deb53ba393bce45b"},{"path":"fixtures/v1_draft/scenarios/actor_counters/actor_counter_start_op.expected.json","sha256":"031d9d844a19ddba1dc864e3cfda4c98c0ca0afc1c8e60e4ecd158b953b7e3db"},{"path":"fixtures/v1_draft/scenarios/actor_counters/actor_counter_start_op.fixture.json","sha256":"8edc27ab4a2fda4fb79f393e447a75905ecb56d07b9d916ad2f9e71ad6e44d46"},{"path":"fixtures/v1_draft/scenarios/actor_counters/actor_counter_start_op.input.json","sha256":"66c82ff3b5ef6d1e314e2af42f068b55c38fb14ea2c0c21e239befaf8575667e"},{"path":"fixtures/v1_draft/scenarios/branch/change_references_invalid_noncanonical_child.expected.json","sha256":"75d6852220efc909001332ca6010da180863f2ceea49ddcfb281433ff54a5278"},{"path":"fixtures/v1_draft/scenarios/branch/change_references_invalid_noncanonical_child.fixture.json","sha256":"bb8db378e64e0c5a690ea5c98fe691f079aebeb815edd5ffbd1362e250fa2d62"},{"path":"fixtures/v1_draft/scenarios/branch/change_references_invalid_noncanonical_child.input.json","sha256":"96e08dcffd2f59b2f493153af8a67b3993aad3318d3f4268d42c7dfecb3e5241"},{"path":"fixtures/v1_draft/scenarios/branch/manifest_references_invalid_noncanonical_child.expected.json","sha256":"cadb29496eec9800a5a699e9024829c5e544f1a816890d30a53f4a72da92b940"},{"path":"fixtures/v1_draft/scenarios/branch/manifest_references_invalid_noncanonical_child.fixture.json","sha256":"d9711f2fbffe30fb3d55e08416d21c682e58e902ec956a56d07ad356e9213de3"},{"path":"fixtures/v1_draft/scenarios/branch/manifest_references_invalid_noncanonical_child.input.json","sha256":"4ad64da9a2056558d279c0e0bf3b669312463c9696822b2c7466c2267d621a96"},{"path":"fixtures/v1_draft/scenarios/branch/noncanonical_child_excluded_base_head.expected.json","sha256":"d632c8f18543f97bab45995e78e58ef6cd69d8f62f3ad293c83b4c0f198c6691"},{"path":"fixtures/v1_draft/scenarios/branch/noncanonical_child_excluded_base_head.fixture.json","sha256":"b062872b320de1a56ad4165d71a285e905a8c54b803b75e4c92f6f0a3032a340"},{"path":"fixtures/v1_draft/scenarios/branch/noncanonical_child_excluded_base_head.input.json","sha256":"387d38434750373edb609eaa19f23960e7a2a892c6a8a985ff37cb52a3696bfc"},{"path":"fixtures/v1_draft/scenarios/branch/noncanonical_child_invalid_base_head.expected.json","sha256":"79307a699df2c0549f64a174720cf349f9813f71a5f49cf78fce68cd4b3ea865"},{"path":"fixtures/v1_draft/scenarios/branch/noncanonical_child_invalid_base_head.fixture.json","sha256":"5c6c84c436ba1d8b3a0fed98f44ff521c33a5d590ec92a0d8f1e04f8abf983fb"},{"path":"fixtures/v1_draft/scenarios/branch/noncanonical_child_invalid_base_head.input.json","sha256":"9f488da9d7c1641f43527e91517da8b6a5e6a6970fa9d0c366e38e2d13efb0a0"},{"path":"fixtures/v1_draft/scenarios/branch/noncanonical_child_pending_base_head.expected.json","sha256":"e6360133435f6be8ecf923b0b307ad16ea2e0193b1e6bed04a76d3b2dc5fa200"},{"path":"fixtures/v1_draft/scenarios/branch/noncanonical_child_pending_base_head.fixture.json","sha256":"8f844cb89301a11abc715c5ed5454c6d8cb84449e009adb7d0856928328f8111"},{"path":"fixtures/v1_draft/scenarios/branch/noncanonical_child_pending_base_head.input.json","sha256":"fc0deaccceaa0f7d870deed94ea3a7bca3f03d0518878e46c09253204042d058"},{"path":"fixtures/v1_draft/scenarios/branch/noncanonical_grandchild_invalid_parent_epoch.expected.json","sha256":"47265dc3d632f500bec5f5b02a383d1f837ce8dbb598b204bbd26cb564b74c11"},{"path":"fixtures/v1_draft/scenarios/branch/noncanonical_grandchild_invalid_parent_epoch.fixture.json","sha256":"129cfbb3113e555cc495337e0e018da9a4d19753d348ec1ecdad9e5d09852300"},{"path":"fixtures/v1_draft/scenarios/branch/noncanonical_grandchild_invalid_parent_epoch.input.json","sha256":"8098586a0e92d3f972abadc8749535e3ff37baa2e43726721eb4d1167de275b7"},{"path":"fixtures/